data,canal,tema,resumo,resolvido
2025-09-15,chat,Simulação de investimento,Cálculo de rendimento em CDB com explicação educacional sobre rentabilidade,sim
2025-09-22,voz,Organização de gastos,Usuário solicitou análise de despesas mensais e sugestões de economia,sim
2025-10-01,chat,Tesouro Direto,Explicação simplificada sobre funcionamento do Tesouro Selic e sua segurança,sim
2025-10-12,chat,Meta financeira,Usuário acompanhou progresso da reserva de emergência com simulação de metas,sim
2025-10-25,voz,Perfil financeiro,Atualização do perfil do usuário para personalização das respostas do agente,sim
